State,LGA,Ward,PU-Code,PU-Name,Accredited_Voters,Registered_Voters,Results_Found,Transcription_Count,Result_Sheet_Stamped,Result_Sheet_Corrected,Result_Sheet_Invalid,Result_Sheet_Unclear,Result_Sheet_Unsigned,APC,LP,PDP,NNPP,Results_File
DELTA,ETHIOPE  EAST,AGBON  I,10-05-04-001,OKPARA  INLAND I OKPARA  T/HALL,0,0,0,0,1,0,1,1,0,0,0,0,0,
DELTA,ETHIOPE  EAST,AGBON  I,10-05-04-002,OKPARA  INLAND I /GIRLS  P/S  I,0,0,0,0,1,0,1,1,0,0,0,0,0,
DELTA,ETHIOPE  EAST,AGBON  I,10-05-04-003,OKPARA  INLAND I /GIRLS  P/S  II,0,0,0,0,1,0,1,1,0,0,0,0,0,
DELTA,ETHIOPE  EAST,AGBON  I,10-05-04-004,OKPARA  INLAND I /URHUEGBE  P/S,0,0,0,0,1,0,1,1,0,0,0,0,0,
DELTA,ETHIOPE  EAST,AGBON  I,10-05-04-005,OKPARA  INLAND I /URHUEGBE  QUARTERS,0,0,0,0,1,0,1,1,0,0,0,0,0,
DELTA,ETHIOPE  EAST,AGBON  I,10-05-04-006,OKPARA  INLAND I /GOVERNMENT MARKET AREA,0,0,0,0,1,0,1,1,0,0,0,0,0,
DELTA,ETHIOPE  EAST,AGBON  I,10-05-04-007,OKPARA  INLAND I /AGBON COLLEGE HALL,0,0,0,0,1,0,1,1,0,0,0,0,0,
DELTA,ETHIOPE  EAST,AGBON  I,10-05-04-008,OKPARA INLAND II/EJAIFE  P/S HALL,0,0,0,0,1,0,1,1,0,0,0,0,0,
DELTA,ETHIOPE  EAST,AGBON  I,10-05-04-009,OKPARA INLAND II/LOCAL GOVERNMENT DISPENSARY,0,0,0,0,1,0,1,1,0,0,0,0,0,
DELTA,ETHIOPE  EAST,AGBON  I,10-05-04-010,OKORUNOH/EYAKURE  P/S,0,0,0,0,1,0,1,1,0,0,0,0,0,
DELTA,ETHIOPE  EAST,AGBON  I,10-05-04-011,UTUYO/UTUYO VILLAGE,0,0,0,0,1,0,1,1,0,0,0,0,0,
DELTA,ETHIOPE  EAST,AGBON  I,10-05-04-012,IMODJE/IMODJE  VILLAGE,0,0,0,0,1,0,1,1,0,0,0,0,0,
DELTA,ETHIOPE  EAST,AGBON  I,10-05-04-013,EKPAGHA/EKPAGHA  P/S,0,0,0,0,1,0,1,1,0,0,0,0,0,
DELTA,ETHIOPE  EAST,AGBON  I,10-05-04-015,OKUREKPO/OKUREKPO  P/S  II,0,0,0,0,1,0,1,1,0,0,0,0,0,
DELTA,ETHIOPE  EAST,AGBON  I,10-05-04-016,OKUREKPO/ONUDE  QUARTERS  I,0,0,0,0,1,0,1,1,0,0,0,0,0,
DELTA,ETHIOPE  EAST,AGBON  I,10-05-04-017,OKUREKPO/ONUDE  QUARTERS  II,0,0,0,0,1,0,1,1,0,0,0,0,0,
DELTA,ETHIOPE  EAST,AGBON  III,10-05-06-004,KOKORI I/KOKORI  T/HALL,0,0,0,0,1,0,1,1,0,0,0,0,0,
DELTA,ETHIOPE  EAST,AGBON  VI,10-05-09-012,EKU II/AGANBI  G/S II,0,0,0,0,1,0,1,1,0,0,0,0,0,
DELTA,ETHIOPE  EAST,AGBON  VIII,10-05-11-001,"FRONT OF OBOH'S COMPOUND, ISIOKOLO",0,0,0,0,1,0,1,1,0,0,0,0,0,
DELTA,ETHIOPE  EAST,AGBON  VIII,10-05-11-003,"AGBON PRIM. SCH., ISIOKOLO",0,0,0,0,1,0,1,1,0,0,0,0,0,
DELTA,ETHIOPE  WEST,JESSE  I,10-06-03-015,IDJERAKA/OPEN SPACE,0,0,0,0,1,0,1,1,0,0,0,0,0,
DELTA,ETHIOPE  WEST,OGHARA I,10-06-07-010,IJOMI/IJOMI PRIMARY SCHOOL,0,0,0,0,1,0,1,1,0,0,0,0,0,
DELTA,IKA NORTH- EAST,OWA I,10-07-01-001,"OBAIGBENA PRIMARY SCHOOL, OWA -OYIBU I",0,0,0,0,1,0,1,1,0,0,0,0,0,
DELTA,IKA NORTH- EAST,OWA I,10-07-01-002,"OBAIGBENA PRIMARY SCHOOL, OWA -OYIBU II",0,0,0,0,1,0,1,1,0,0,0,0,0,
DELTA,IKA NORTH- EAST,OWA I,10-07-01-003,"OBAIGBENA PRIMARY SCHOOL, OWA -OYIBU III",0,0,0,0,1,0,1,1,0,0,0,0,0,
DELTA,IKA NORTH- EAST,OWA I,10-07-01-004,"COURT HALL, OWA - OYIBU I",0,0,0,0,1,0,1,1,0,0,0,0,0,
DELTA,IKA NORTH- EAST,OWA I,10-07-01-005,"COURT HALL, OWA - OYIBU II",0,0,0,0,1,0,1,1,0,0,0,0,0,
DELTA,IKA NORTH- EAST,OWA I,10-07-01-006,"COURT HALL, OWA - OYIBU III",0,0,0,0,1,0,1,1,0,0,0,0,0,
DELTA,IKA NORTH- EAST,OWA I,10-07-01-007,"COURT HALL, OWA - OYIBU IV",0,0,0,0,1,0,1,1,0,0,0,0,0,
DELTA,IKA NORTH- EAST,OWA I,10-07-01-008,"OBISI PRIMARY SCHOOL, OWA - OYIBU I",0,0,0,0,1,0,1,1,0,0,0,0,0,
DELTA,IKA NORTH- EAST,OWA I,10-07-01-010,"OBISI PRIMARY SCHOOL, OWA - OYIBU III",0,0,0,0,1,0,1,1,0,0,0,0,0,
DELTA,IKA NORTH- EAST,OWA I,10-07-01-011,"RALL -WAY CAMP, OWA - OYIBU",0,0,0,0,1,0,1,1,0,0,0,0,0,
DELTA,IKA NORTH- EAST,OWA I,10-07-01-012,"ISIBOR PRIMARY SCHOOL, OWA - ALIDINMA",0,0,0,0,1,0,1,1,0,0,0,0,0,
DELTA,IKA NORTH- EAST,OWA II,10-07-02-001,"OMI PRIMARY SCHOOL, OWA - ALERO I",0,0,0,0,1,0,1,1,0,0,0,0,0,
DELTA,IKA NORTH- EAST,OWA II,10-07-02-006,"UGBEKILE HALL, OWA-ALERO I",0,0,0,0,1,0,1,1,0,0,0,0,0,
DELTA,IKA NORTH- EAST,OWA II,10-07-02-007,"UGBEKILE HALL, OWA-ALERO II",0,0,0,0,1,0,1,1,0,0,0,0,0,
DELTA,IKA NORTH- EAST,OWA II,10-07-02-008,"EGWE PRIMARY SCHOOL, OWA - ALERO I",0,0,0,0,1,0,1,1,0,0,0,0,0,
DELTA,IKA NORTH- EAST,OWA II,10-07-02-009,"EGWE PRIMARY SCHOOL, OWA - ALERO II",0,0,0,0,1,0,1,1,0,0,0,0,0,
DELTA,IKA NORTH- EAST,OWA II,10-07-02-010,"EGWE PRIMARY SCHOOL, OWA - ALERO III",0,0,0,0,1,0,1,1,0,0,0,0,0,
DELTA,IKA NORTH- EAST,OWA II,10-07-02-011,"IRORO PRIMARY SCHOOL, OWA - ALERO I",0,0,0,0,1,0,1,1,0,0,0,0,0,
DELTA,IKA NORTH- EAST,OWA II,10-07-02-012,"IRORO PRIMARY SCHOOL, OWA - ALERO II",0,0,0,0,1,0,1,1,0,0,0,0,0,
DELTA,IKA NORTH- EAST,OWA II,10-07-02-013,"IRORO PRIMARY SCHOOL, OWA - ALERO III",0,0,0,0,1,0,1,1,0,0,0,0,0,
DELTA,IKA NORTH- EAST,OWA II,10-07-02-014,"IRORO PRIMARY SCHOOL, OWA - ALERO IV",0,0,0,0,1,0,1,1,0,0,0,0,0,
DELTA,IKA NORTH- EAST,OWA III,10-07-03-001,"ALASI PRIMARY SCHOOL, BOJI - BOJI, OWA I",0,0,0,0,1,0,1,1,0,0,0,0,0,
DELTA,IKA NORTH- EAST,OWA III,10-07-03-002,"ALASI PRIMARY SCHOOL, BOJI - BOJI, OWA II",0,0,0,0,1,0,1,1,0,0,0,0,0,
DELTA,IKA NORTH- EAST,OWA III,10-07-03-003,"ALASI PRIMARY SCHOOL, BOJI - BOJI, OWA III",0,0,0,0,1,0,1,1,0,0,0,0,0,
DELTA,IKA NORTH- EAST,OWA III,10-07-03-004,"ALASI PRIMARY SCHOOL, BOJI - BOJI, OWA IV",0,0,0,0,1,0,1,1,0,0,0,0,0,
DELTA,IKA NORTH- EAST,OWA III,10-07-03-005,"IKA GRAMMAR SCHOOL, OLD LAGOS/ASABA ROAD I",0,0,0,0,1,0,1,1,0,0,0,0,0,
DELTA,IKA NORTH- EAST,OWA III,10-07-03-006,"IKA GRAMMAR SCHOOL, OLD LAGOS/ASABA ROAD II",0,0,0,0,1,0,1,1,0,0,0,0,0,
DELTA,IKA NORTH- EAST,OWA III,10-07-03-007,"IKA GRAMMAR SCHOOL III, OLD LAGOS/ASABA ROAD",0,0,0,0,1,0,1,1,0,0,0,0,0,
DELTA,IKA NORTH- EAST,OWA III,10-07-03-008,"UTE - OKPU HALL, BOJI-BOJI, OWA",0,0,0,0,1,0,1,1,0,0,0,0,0,
DELTA,IKA NORTH- EAST,OWA III,10-07-03-009,"OWANTA LAND OFFICE, BOJI-BOJI, OWA I",0,0,0,0,1,0,1,1,0,0,0,0,0,
DELTA,IKA NORTH- EAST,OWA III,10-07-03-010,"OWANTA LAND OFFICE, BOJI-BOJI, OWA II",0,0,0,0,1,0,1,1,0,0,0,0,0,
DELTA,IKA NORTH- EAST,OWA III,10-07-03-011,"OWANTA LAND OFFICE, BOJI-BOJ,I OWA III",0,0,0,0,1,0,1,1,0,0,0,0,0,
DELTA,IKA NORTH- EAST,OWA III,10-07-03-012,"OWANTA LAND OFFICE, BOJI-BOJI, OWA IV",0,0,0,0,1,0,1,1,0,0,0,0,0,
DELTA,IKA NORTH- EAST,OWA  V,10-07-05-001,"IYI - AGHULOR PRIMARY SCHOOL, OWANTA I",0,0,0,0,1,0,1,1,0,0,0,0,0,
DELTA,IKA NORTH- EAST,OWA  V,10-07-05-002,"IYI - AGHULOR PRIMARY SCHOOL, OWANTA II",0,0,0,0,1,0,1,1,0,0,0,0,0,
DELTA,IKA NORTH- EAST,OWA  V,10-07-05-003,"IYI - AGHULOR PRIMARY SCHOOL, OWANTA III",0,0,0,0,1,0,1,1,0,0,0,0,0,
DELTA,IKA NORTH- EAST,OWA  V,10-07-05-004,"OSIMI PRIMARY SCHOOL, OWANTA ALOSIMI I",0,0,0,0,1,0,1,1,0,0,0,0,0,
DELTA,IKA NORTH- EAST,OWA  V,10-07-05-005,"OSIMI PRIMARY SCHOOL, OWANTA ALOSIMI II",0,0,0,0,1,0,1,1,0,0,0,0,0,
DELTA,IKA NORTH- EAST,OWA  V,10-07-05-006,"OSIMI PRIMARY SCHOOL, OWANTA ALOSIMI III",0,0,0,0,1,0,1,1,0,0,0,0,0,
DELTA,IKA NORTH- EAST,OWA  V,10-07-05-007,"OSIMI PRIMARY SCHOOL, OWANTA ALOSIMI IV",0,0,0,0,1,0,1,1,0,0,0,0,0,
DELTA,IKA NORTH- EAST,OWA  VI,10-07-06-001,"ADAGBA PRIMARY SCHOOL, OWA - OFIE I",0,0,0,0,1,0,1,1,0,0,0,0,0,
DELTA,IKA NORTH- EAST,OWA  VI,10-07-06-002,"ADAGBA PRIMARY SCHOOL, OWA - OFIE II",0,0,0,0,1,0,1,1,0,0,0,0,0,
DELTA,IKA NORTH- EAST,OWA  VI,10-07-06-003,"OZOMOR PRIMARY SCHOOL, ALIZOMOR I",0,0,0,0,1,0,1,1,0,0,0,0,0,
DELTA,IKA NORTH- EAST,OWA  VI,10-07-06-006,"OZOMOR PRIMARY SCHOOL, ALIZOMOR IV",0,0,0,0,1,0,1,1,0,0,0,0,0,
DELTA,IKA NORTH- EAST,OWA  VI,10-07-06-007,"OZOMOR TOWN HALL, ALIZOMOR",0,0,0,0,1,0,1,1,0,0,0,0,0,
DELTA,IKA NORTH- EAST,OWA  VI,10-07-06-009,"OWA-EKEI PRIMARY SCHOOL,OWA - EKEI II",0,0,0,0,1,0,1,1,0,0,0,0,0,
DELTA,IKA NORTH- EAST,AKUMAZI,10-07-07-001,"UMUOCHA PRIMARY SCHOOL, AKUMAZI I",0,0,0,0,1,0,1,1,0,0,0,0,0,
DELTA,IKA NORTH- EAST,AKUMAZI,10-07-07-002,"UMUOCHA PRIMARY SCHOOL, AKUMAZI II",0,0,0,0,1,0,1,1,0,0,0,0,0,
DELTA,IKA NORTH- EAST,AKUMAZI,10-07-07-003,"UMUOCHA PRIMARY SCHOOL, AKUMAZI III",0,0,0,0,1,0,1,1,0,0,0,0,0,
DELTA,IKA NORTH- EAST,AKUMAZI,10-07-07-004,"AKUMA PRIMARY SCHOOL, AKUMAZI I",0,0,0,0,1,0,1,1,0,0,0,0,0,
DELTA,IKA NORTH- EAST,AKUMAZI,10-07-07-005,"AKUMA PRIMARY SCHOOL, AKUMAZI II",0,0,0,0,1,0,1,1,0,0,0,0,0,
DELTA,IKA NORTH- EAST,AKUMAZI,10-07-07-006,"USENU PRIMARY SCHOOL, OWERRE - OLUBOR I",0,0,0,0,1,0,1,1,0,0,0,0,0,
DELTA,IKA NORTH- EAST,AKUMAZI,10-07-07-007,"USENU PRIMARY SCHOOL, OWERRE - OLUBOR II",0,0,0,0,1,0,1,1,0,0,0,0,0,
DELTA,IKA NORTH- EAST,AKUMAZI,10-07-07-008,DIAGBO PRIMARY SCHOOL OWERRE-OLUBOR I,0,0,0,0,1,0,1,1,0,0,0,0,0,
DELTA,IKA NORTH- EAST,AKUMAZI,10-07-07-009,DIAGBO PRIMARY SCHOOL OWERRE-OLUBOR II,0,0,0,0,1,0,1,1,0,0,0,0,0,
DELTA,IKA NORTH- EAST,AKUMAZI,10-07-07-010,"COURT HALL, OWERRE - OLUBOR",0,0,0,0,1,0,1,1,0,0,0,0,0,
DELTA,IKA NORTH- EAST,AKUMAZI,10-07-07-011,"AMUFA PRIMARY SCHOOL, EKUOMA I",0,0,0,0,1,0,1,1,0,0,0,0,0,
DELTA,IKA NORTH- EAST,AKUMAZI,10-07-07-012,"AMUFA PRIMARY SCHOOL, EKUOMA II",0,0,0,0,1,0,1,1,0,0,0,0,0,
DELTA,IKA NORTH- EAST,AKUMAZI,10-07-07-013,"COMMUNITY HALL, EKUOMA I",0,0,0,0,1,0,1,1,0,0,0,0,0,
DELTA,IKA NORTH- EAST,AKUMAZI,10-07-07-014,"COMMUNITY HALL, EKUOMA II",0,0,0,0,1,0,1,1,0,0,0,0,0,
DELTA,IKA NORTH- EAST,UTE - OKPU,10-07-09-004,"EKPU PRIMARY SCHOOL, UTE - OKPU IV",0,0,0,0,1,0,1,1,0,0,0,0,0,
DELTA,IKA NORTH- EAST,UTE - OKPU,10-07-09-008,"AGHAULOR PRIMARY SCHOOL , UTE - OKPU IV",0,0,0,0,1,0,1,1,0,0,0,0,0,
DELTA,IKA NORTH- EAST,IDUMUESAH,10-07-10-001,"OGBENO PRIMARY SCHOOL, IDUMUESAH I",0,0,0,0,1,0,1,1,0,0,0,0,0,
DELTA,IKA NORTH- EAST,IDUMUESAH,10-07-10-002,"OGBENO PRIMARY SCHOOL, IDUMUESAH II",0,0,0,0,1,0,1,1,0,0,0,0,0,
DELTA,IKA NORTH- EAST,IDUMUESAH,10-07-10-003,"OGBENO PRIMARY SCHOOL, IDUMUESAH III",0,0,0,0,1,0,1,1,0,0,0,0,0,
DELTA,IKA NORTH- EAST,IDUMUESAH,10-07-10-004,"IBILI PRIMARY SCHOOL, IDUMUESAH I",0,0,0,0,1,0,1,1,0,0,0,0,0,
DELTA,IKA NORTH- EAST,IDUMUESAH,10-07-10-005,"IBILI PRIMARY SCHOOL, IDUMUESAH II",0,0,0,0,1,0,1,1,0,0,0,0,0,
DELTA,IKA NORTH- EAST,IDUMUESAH,10-07-10-006,"IBILI PRIMARY SCHOOL, IDUMUESAH III",0,0,0,0,1,0,1,1,0,0,0,0,0,
DELTA,IKA NORTH- EAST,IDUMUESAH,10-07-10-007,"COMMUNITY HALL, IDUMUESAH I",0,0,0,0,1,0,1,1,0,0,0,0,0,
DELTA,IKA NORTH- EAST,IDUMUESAH,10-07-10-008,"COMMUNITY HALL, IDUMUESAH II",0,0,0,0,1,0,1,1,0,0,0,0,0,
DELTA,IKA NORTH- EAST,UMUNEDE,10-07-11-001,"OGBE MODEL PRIMARY SCHOOL, UMUNEDE I",0,0,0,0,1,0,1,1,0,0,0,0,0,
DELTA,IKA NORTH- EAST,UMUNEDE,10-07-11-002,"OGBE MODEL PRIMARY SCHOOL, UMUNEDE II",0,0,0,0,1,0,1,1,0,0,0,0,0,
DELTA,IKA NORTH- EAST,UMUNEDE,10-07-11-003,"OGBE MODEL PRIMARY SCHOOL, UMUNEDE III",0,0,0,0,1,0,1,1,0,0,0,0,0,
DELTA,IKA NORTH- EAST,UMUNEDE,10-07-11-004,"IJEHON PRIMARY SCHOOL, UMUNEDE I",0,0,0,0,1,0,1,1,0,0,0,0,0,
DELTA,IKA NORTH- EAST,UMUNEDE,10-07-11-005,"IJEHON PRIMARY SCHOOL, UMUNEDE II",0,0,0,0,1,0,1,1,0,0,0,0,0,
DELTA,IKA NORTH- EAST,UMUNEDE,10-07-11-006,"IJEHON PRIMARY SCHOOL, UMUNEDE III",0,0,0,0,1,0,1,1,0,0,0,0,0,
DELTA,IKA NORTH- EAST,UMUNEDE,10-07-11-007,"IJEHON PRIMARY SCHOOL, UMUNEDE IV",0,0,0,0,1,0,1,1,0,0,0,0,0,
DELTA,IKA NORTH- EAST,UMUNEDE,10-07-11-008,"DIAI PRIMARY SCHOOL, UMUNEDE",0,0,0,0,1,0,1,1,0,0,0,0,0,
DELTA,IKA NORTH- EAST,UMUNEDE,10-07-11-009,"IYEI PRIMARY SCHOOL, UMUNEDE I",0,0,0,0,1,0,1,1,0,0,0,0,0,
DELTA,IKA NORTH- EAST,UMUNEDE,10-07-11-010,"IYEI PRIMARY SCHOOL, UMUNEDE II",0,0,0,0,1,0,1,1,0,0,0,0,0,
DELTA,IKA NORTH- EAST,UMUNEDE,10-07-11-011,"ONYEAGWU PRIMARY SCHOOL, UMUNEDE",0,0,0,0,1,0,1,1,0,0,0,0,0,
DELTA,IKA NORTH- EAST,UMUNEDE,10-07-11-012,"COURT HALL, UMUNEDE I",0,0,0,0,1,0,1,1,0,0,0,0,0,
DELTA,IKA NORTH- EAST,UMUNEDE,10-07-11-013,"COURT HALL, UMUNEDE II",0,0,0,0,1,0,1,1,0,0,0,0,0,
DELTA,IKA NORTH- EAST,UMUNEDE,10-07-11-014,"COURT HALL, UMUNEDE III",0,0,0,0,1,0,1,1,0,0,0,0,0,
DELTA,IKA NORTH- EAST,UMUNEDE,10-07-11-015,"NEW LAGOS/ASABA ROAD, UMUNEDE I",0,0,0,0,1,0,1,1,0,0,0,0,0,
DELTA,IKA NORTH- EAST,UMUNEDE,10-07-11-016,"NEW LAGOS/ASABA ROAD, UMUNEDE II",0,0,0,0,1,0,1,1,0,0,0,0,0,
DELTA,IKA NORTH- EAST,UMUNEDE,10-07-11-017,"NEW LAGOS/ASABA ROAD, UMUNEDE III",0,0,0,0,1,0,1,1,0,0,0,0,0,
DELTA,IKA NORTH- EAST,MBIRI,10-07-12-001,"AREN PRIMARY SCHOOL, MBIRI I",0,0,0,0,1,0,1,1,0,0,0,0,0,
DELTA,IKA NORTH- EAST,MBIRI,10-07-12-003,"AREN PRIMARY SCHOOL, MBIRI III",0,0,0,0,1,0,1,1,0,0,0,0,0,
DELTA,IKA NORTH- EAST,MBIRI,10-07-12-005,"OKEI PRIMARY SCHOOL, MBIRI I",0,0,0,0,1,0,1,1,0,0,0,0,0,
DELTA,IKA NORTH- EAST,MBIRI,10-07-12-006,"OKEI PRIMARY SCHOOL, MBIRI II",0,0,0,0,1,0,1,1,0,0,0,0,0,
DELTA,IKA NORTH- EAST,MBIRI,10-07-12-008,"OTUGBO PRIMARY SCHOOL, MBIRI I",0,0,0,0,1,0,1,1,0,0,0,0,0,
DELTA,IKA NORTH- EAST,MBIRI,10-07-12-009,"OTUGBO PRIMARY SCHOOL, MBIRI II",0,0,0,0,1,0,1,1,0,0,0,0,0,
DELTA,IKA NORTH- EAST,OTOLOKPO,10-07-14-001,"AZAGBA PRIMARY SCHOOL, OTOLOKPO I",0,0,0,0,1,0,1,1,0,0,0,0,0,
DELTA,IKA NORTH- EAST,OTOLOKPO,10-07-14-002,"AZAGBA PRIMARY SCHOOL, OTOLOKPO II",0,0,0,0,1,0,1,1,0,0,0,0,0,
DELTA,IKA NORTH- EAST,OTOLOKPO,10-07-14-003,"OKETE TOWN HALL, OTOLOKPO I",0,0,0,0,1,0,1,1,0,0,0,0,0,
DELTA,IKA NORTH- EAST,OTOLOKPO,10-07-14-004,"OKETE TOWN HALL, OTOLOKPO II",0,0,0,0,1,0,1,1,0,0,0,0,0,
DELTA,IKA NORTH- EAST,OTOLOKPO,10-07-14-005,"UMUHU QUARTERS, OTOLOKPO",0,0,0,0,1,0,1,1,0,0,0,0,0,
DELTA,ISOKO SOUTH,AVIARA,10-10-03-020,"OVU SQUARE, OTULOHO",0,0,0,0,1,0,1,1,0,0,0,0,0,
DELTA,ISOKO SOUTH,UZERE,10-10-04-009,"UKISE  HALL, UHERI",0,0,0,0,1,0,1,1,0,0,0,0,0,
DELTA,ISOKO SOUTH,EMEDE,10-10-05-013,"URUOHO HALL, ENUTO QUARTERS II",0,0,0,0,1,0,1,1,0,0,0,0,0,
DELTA,ISOKO SOUTH,ENHWE/OKPOLO,10-10-09-001,"EYARA HALL, EYARA, ULEWE, EMAKA QUARTERS",0,0,0,0,1,0,1,1,0,0,0,0,0,
DELTA,ISOKO SOUTH,ENHWE/OKPOLO,10-10-09-002,"UTOHO HALL, EYARA, ULEWE, EMAKA QUARTERS",0,0,0,0,1,0,1,1,0,0,0,0,0,
DELTA,ISOKO SOUTH,ENHWE/OKPOLO,10-10-09-003,"ULEWE HALL, ULEWE QUARTERS",0,0,0,0,1,0,1,1,0,0,0,0,0,
DELTA,ISOKO SOUTH,ENHWE/OKPOLO,10-10-09-004,"EMAKA HALL, EMAKA QUARTERS I",0,0,0,0,1,0,1,1,0,0,0,0,0,
DELTA,ISOKO SOUTH,ENHWE/OKPOLO,10-10-09-005,"OKPOLO PRIMARY SCHOOL, EYARA, ULEWE, EMAKA I",0,0,0,0,1,0,1,1,0,0,0,0,0,
DELTA,ISOKO SOUTH,ENHWE/OKPOLO,10-10-09-006,"OKPOLO PRIMARY SCHOOL, EYARA, ULEWE, EMAKA II",0,0,0,0,1,0,1,1,0,0,0,0,0,
DELTA,ISOKO SOUTH,ENHWE/OKPOLO,10-10-09-007,"EDI HALL, OLADE, ETEVIE QUARTERS",0,0,0,0,1,0,1,1,0,0,0,0,0,
DELTA,ISOKO SOUTH,ENHWE/OKPOLO,10-10-09-008,"URUOLE HALL, OLADE, ETEVIE QUARTERS",0,0,0,0,1,0,1,1,0,0,0,0,0,
DELTA,ISOKO SOUTH,ENHWE/OKPOLO,10-10-09-009,"OVIOTA PRIMARY SCHOOL, OLADE, ETEVIE QUARTERS I",0,0,0,0,1,0,1,1,0,0,0,0,0,
DELTA,ISOKO SOUTH,ENHWE/OKPOLO,10-10-09-010,"OVIOTA PRIMARY SCHOOL, OLADE, ETEVIE QUARTERS II",0,0,0,0,1,0,1,1,0,0,0,0,0,
DELTA,ISOKO SOUTH,ENHWE/OKPOLO,10-10-09-011,"EKROVIE HALL, EKROVIE/UKUREDE",0,0,0,0,1,0,1,1,0,0,0,0,0,
DELTA,ISOKO SOUTH,ENHWE/OKPOLO,10-10-09-012,"UYARAWA HALL, EKROVIE/UKUREDE",0,0,0,0,1,0,1,1,0,0,0,0,0,
DELTA,ISOKO SOUTH,ENHWE/OKPOLO,10-10-09-013,"EMAKA HALL, EMAKA QUARTERS II",0,0,0,0,1,0,1,1,0,0,0,0,0,
DELTA,ISOKO SOUTH,IRRI I,10-10-10-007,"INYEKPOKPO QUARTERS, EVIEWHO",0,0,0,0,1,0,1,1,0,0,0,0,0,
DELTA,ISOKO SOUTH,IRRI I,10-10-10-012,"UGIRIAMA, UZI",0,0,0,0,1,0,1,1,0,0,0,0,0,
DELTA,NDOKWA EAST,ABOH/AKARRAI,10-11-05-008,"OGWEZI PRIMARY SCHOOL,  ABOH III ",0,0,0,0,1,0,1,1,0,0,0,0,0,
DELTA,NDOKWA EAST,IBREDE/IGBUKU / ONOGBOKOR,10-11-09-004,"EGBEDI PRIMARY SCHOOL, IBREDE  IV",0,0,0,0,1,0,1,1,0,0,0,0,0,
DELTA,NDOKWA EAST,IBREDE/IGBUKU / ONOGBOKOR,10-11-09-009,"ANYAMA OPEN SPACE,  ANYAMA",0,0,0,0,1,0,1,1,0,0,0,0,0,
DELTA,NDOKWA EAST,ASHAKA,10-11-10-007,"ASHAKA   PRIMARY SCHOOL, ASHAKA II",0,0,0,0,1,0,1,1,0,0,0,0,0,
DELTA,OKPE,OREROKPE,10-13-01-006,"ADANE - OKPE PRIMARY SCHOOL, OREROKPE II",0,0,0,0,1,0,1,1,0,0,0,0,0,
DELTA,OKPE,OREROKPE,10-13-01-013,"OKULOHO PRIMARY SCHOOL, OKULOHO I",0,0,0,0,1,0,1,1,0,0,0,0,0,
DELTA,OKPE,MEREJE  III,10-13-09-014,"OKUFUOMA TOWN HALL, OKUFUOMA",0,0,0,0,1,0,1,1,0,0,0,0,0,
DELTA,OKPE,MEREJE  III,10-13-09-015,"OKUOVWISI TOWN HALL, OKUOVWISI",0,0,0,0,1,0,1,1,0,0,0,0,0,
DELTA,OKPE,UGHOTON,10-13-10-012,"JEDDO UDUMUEGHELETA, JEDDO",0,0,0,0,1,0,1,1,0,0,0,0,0,
DELTA,OSHIMILI - NORTH,OKPANAM,10-14-09-008,SAVIORS APOSTOLIC CHURCH - OGBEOSADI OKOTOMI/DELEI/ANWAI CAMP,0,0,0,0,1,0,1,1,0,0,0,0,0,
DELTA,OSHIMILI - SOUTH,OGBELE/AKPAKO,10-15-01-010,AKPAKO PRIMARY SCHOOL - ANINTA,0,0,0,0,1,0,1,1,0,0,0,0,0,
DELTA,OSHIMILI - SOUTH,ANALA-AMAKOM,10-15-02-002,ANALA PRIMARY SCHOOL - ANALA II,0,0,0,0,1,0,1,1,0,0,0,0,0,
DELTA,OSHIMILI - SOUTH,ANALA-AMAKOM,10-15-02-003,ANALA PRIMARY SCHOOL - ANALA III,0,0,0,0,1,0,1,1,0,0,0,0,0,
DELTA,OSHIMILI - SOUTH,ANALA-AMAKOM,10-15-02-004,ANALA PRIMARY SCHOOL - ANALA IV,0,0,0,0,1,0,1,1,0,0,0,0,0,
DELTA,OSHIMILI - SOUTH,ANALA-AMAKOM,10-15-02-005,OBI-OKPU PRIMARY SCHOOL - OBI-OKPU I,0,0,0,0,1,0,1,1,0,0,0,0,0,
DELTA,OSHIMILI - SOUTH,ANALA-AMAKOM,10-15-02-007,AMAKOM PRIMARY SCHOOL - AMAKOM I,0,0,0,0,1,0,1,1,0,0,0,0,0,
DELTA,OSHIMILI - SOUTH,ANALA-AMAKOM,10-15-02-008,AMAKOM PRIMARY SCHOOL - AMAKOM II,0,0,0,0,1,0,1,1,0,0,0,0,0,
DELTA,OSHIMILI - SOUTH,ANALA-AMAKOM,10-15-02-009,"AMAKOM PRIMARY SCHOOL - UWALE, UWAIKPAI",0,0,0,0,1,0,1,1,0,0,0,0,0,
DELTA,OSHIMILI - SOUTH,ANALA-AMAKOM,10-15-02-010,AMAKOM PRIMARY SCHOOL - IDOKOMADU,0,0,0,0,1,0,1,1,0,0,0,0,0,
DELTA,OSHIMILI - SOUTH,OKWE,10-15-03-001,OKWE PRIMARY SCHOOL - OKWE I,0,0,0,0,1,0,1,1,0,0,0,0,0,
DELTA,OSHIMILI - SOUTH,OKWE,10-15-03-002,OKWE PRIMARY SCHOOL - OKWE II,0,0,0,0,1,0,1,1,0,0,0,0,0,
DELTA,OSHIMILI - SOUTH,OKWE,10-15-03-003,OKWE PRIMARY SCHOOL - OKWE III,0,0,0,0,1,0,1,1,0,0,0,0,0,
DELTA,OSHIMILI - SOUTH,OKWE,10-15-03-004,DEEPER LIFE JUNCTION/MADUEKE MBAEGBU ST,0,0,0,0,1,0,1,1,0,0,0,0,0,
DELTA,OSHIMILI - SOUTH,OKWE,10-15-03-005,LUCIA AVENUE JUNCTION/OKWE PRIMARY SCHOOL ROAD ,0,0,0,0,1,0,1,1,0,0,0,0,0,
DELTA,OSHIMILI - SOUTH,OKWE,10-15-03-006,ALANAZUNWA STREET JUNCTION/ OKWE PRY SCH ROAD,0,0,0,0,1,0,1,1,0,0,0,0,0,
DELTA,OSHIMILI - SOUTH,OKWE,10-15-03-007,IFEANYI IJEH STREET/ ONWA NEACHINEMELU JUNCTION ODUKE,0,0,0,0,1,0,1,1,0,0,0,0,0,
DELTA,OSHIMILI - SOUTH,UMUEZEI,10-15-04-003,ASAGBA PRIMARY SCHOOL - UMUNKWO I,0,0,0,0,1,0,1,1,0,0,0,0,0,
DELTA,OSHIMILI - SOUTH,UMUEZEI,10-15-04-004,ASAGBA PRIMARY SCHOOL - UMUNKWO II,0,0,0,0,1,0,1,1,0,0,0,0,0,
DELTA,OSHIMILI - SOUTH,UMUEZEI,10-15-04-005,ASAGBA MIXED SEC SCH OFF EZENEI AVENUE,0,0,0,0,1,0,1,1,0,0,0,0,0,
DELTA,OSHIMILI - SOUTH,UMUEZEI,10-15-04-006,GTB JUNCTION BY EZENEI AVENUE ,0,0,0,0,1,0,1,1,0,0,0,0,0,
DELTA,OSHIMILI - SOUTH,UMUEZEI,10-15-04-008,AHOR PRY SCH UMUEZEI ASABA II,0,0,0,0,1,0,1,1,0,0,0,0,0,
DELTA,OSHIMILI - SOUTH,UMUEZEI,10-15-04-009,ALLEN JUNCTION UMUEZEI ASABA,0,0,0,0,1,0,1,1,0,0,0,0,0,
DELTA,OSHIMILI - SOUTH,UMUEZEI,10-15-04-010,OGWA UMUANUKPOSI ASABA PALACE I,0,0,0,0,1,0,1,1,0,0,0,0,0,
DELTA,OSHIMILI - SOUTH,UMUEZEI,10-15-04-011,OGWA UMUANUKPOSI ASABA PALACE II,0,0,0,0,1,0,1,1,0,0,0,0,0,
DELTA,OSHIMILI - SOUTH,UMUEZEI,10-15-04-012,NIGER MIXED SECONDARY SCHOOL - EZENEI  AVENUE/UMUEZEI I,0,0,0,0,1,0,1,1,0,0,0,0,0,
DELTA,OSHIMILI - SOUTH,UMUEZEI,10-15-04-013,NIGER MIXED SECONDARY SCHOOL - EZENEI  AVENUE/UMUEZEI II,0,0,0,0,1,0,1,1,0,0,0,0,0,
DELTA,OSHIMILI - SOUTH,UMUEZEI,10-15-04-014,NIGER MIXED SECONDARY SCHOOL - EZENEI  AVENUE/UMUEZEI III,0,0,0,0,1,0,1,1,0,0,0,0,0,
DELTA,OSHIMILI - SOUTH,UMUAJI,10-15-05-002,ABU-ATO PRIMARY SCHOOL - ATUFA/AFEKE I,0,0,0,0,1,0,1,1,0,0,0,0,0,
DELTA,OSHIMILI - SOUTH,UMUAJI,10-15-05-003,ABU-ATO PRIMARY SCHOOL - ATUFA/AFEKE II,0,0,0,0,1,0,1,1,0,0,0,0,0,
DELTA,OSHIMILI - SOUTH,UMUAJI,10-15-05-004,ABU-ATO PRIMARY SCHOOL - ATUFA/AFEKE III,0,0,0,0,1,0,1,1,0,0,0,0,0,
DELTA,OSHIMILI - SOUTH,UMUAJI,10-15-05-005,ABU-ATO PRIMARY SCHOOL - UMUEKWO,0,0,0,0,1,0,1,1,0,0,0,0,0,
DELTA,OSHIMILI - SOUTH,UMUAJI,10-15-05-006,ST. BRIGID'S G.G.  SCHOOL - UMUEKWO I,0,0,0,0,1,0,1,1,0,0,0,0,0,
DELTA,OSHIMILI - SOUTH,UMUAJI,10-15-05-007,ST. BRIGID'S G.G.  SCHOOL - UMUEKWO II,0,0,0,0,1,0,1,1,0,0,0,0,0,
DELTA,OSHIMILI - SOUTH,UMUAJI,10-15-05-008,ST. BRIGID'S G.G.  SCHOOL - UMUEKWO III,0,0,0,0,1,0,1,1,0,0,0,0,0,
DELTA,OSHIMILI - SOUTH,UMUAJI,10-15-05-009,ST. BRIGID'S G.G.  SCHOOL - UMUDA/UDA LAYOUT,0,0,0,0,1,0,1,1,0,0,0,0,0,
DELTA,OSHIMILI - SOUTH,UMUAJI,10-15-05-010,ST. BRIGID'S G.G.  SCHOOL - AGUEZE,0,0,0,0,1,0,1,1,0,0,0,0,0,
DELTA,OSHIMILI - SOUTH,UMUAJI,10-15-05-011,ODUKE NURSERY SCHOOL - ODUKE CAMP,0,0,0,0,1,0,1,1,0,0,0,0,0,
DELTA,OSHIMILI - SOUTH,UGBOMANTA QUARTERS,10-15-08-003,OGWA UMUONISHE  -  ISIEKE I,0,0,0,0,1,0,1,1,0,0,0,0,0,
DELTA,OSHIMILI - SOUTH,UGBOMANTA QUARTERS,10-15-08-004,OGWA UMUONISHE  -  ISIEKE II,0,0,0,0,1,0,1,1,0,0,0,0,0,
DELTA,OSHIMILI - SOUTH,UGBOMANTA QUARTERS,10-15-08-005,ISIEKE JUNCTION BY IBUSA ROAD ASABA,0,0,0,0,1,0,1,1,0,0,0,0,0,
DELTA,OSHIMILI - SOUTH,UGBOMANTA QUARTERS,10-15-08-006,DLA JUNCTION BY IBUSA ROAD ASABA,0,0,0,0,1,0,1,1,0,0,0,0,0,
DELTA,OSHIMILI - SOUTH,UGBOMANTA QUARTERS,10-15-08-007,IBUSA JUNCTION BY NNEBISI ROAD ASABA I,0,0,0,0,1,0,1,1,0,0,0,0,0,
DELTA,OSHIMILI - SOUTH,UGBOMANTA QUARTERS,10-15-08-008,IBUSA JUNCTION BY NNEBISI ROAD ASABA II,0,0,0,0,1,0,1,1,0,0,0,0,0,
DELTA,OSHIMILI - SOUTH,UGBOMANTA QUARTERS,10-15-08-009,NECAB JUNCTION BY NNEBISI ROAD,0,0,0,0,1,0,1,1,0,0,0,0,0,
DELTA,OSHIMILI - SOUTH,UGBOMANTA QUARTERS,10-15-08-010,OGWA OGBEOGWUGWU -  OGBEOGWUGWU,0,0,0,0,1,0,1,1,0,0,0,0,0,
DELTA,OSHIMILI - SOUTH,CABLE POINT  I,10-15-10-001,OMELUGBOMA BY RICEMILL  - OMELUGBOMA,0,0,0,0,1,0,1,1,0,0,0,0,0,
DELTA,OSHIMILI - SOUTH,CABLE POINT  I,10-15-10-002,ONEH PRIMARY SCHOOL - MAMMY MARKET,0,0,0,0,1,0,1,1,0,0,0,0,0,
DELTA,OSHIMILI - SOUTH,CABLE POINT  I,10-15-10-003,ONEH PRIMARY SCHOOL -D/OSADEBAY WAY,0,0,0,0,1,0,1,1,0,0,0,0,0,
DELTA,OSHIMILI - SOUTH,CABLE POINT  I,10-15-10-005,ONEH PRIMARY SCHOOL - ONWUKA  OGBOR ST.,0,0,0,0,1,0,1,1,0,0,0,0,0,
DELTA,OSHIMILI - SOUTH,CABLE POINT  I,10-15-10-007,ONEH PRIMARY SCHOOL JUNCTION,0,0,0,0,1,0,1,1,0,0,0,0,0,
DELTA,OSHIMILI - SOUTH,CABLE POINT  I,10-15-10-008,MAMMY MARKET JUNCTION,0,0,0,0,1,0,1,1,0,0,0,0,0,
DELTA,OSHIMILI - SOUTH,CABLE POINT  I,10-15-10-009,ANI AHABA JUNCTION II,0,0,0,0,1,0,1,1,0,0,0,0,0,
DELTA,OSHIMILI - SOUTH,CABLE POINT  I,10-15-10-010,ALL SAINTS ANGLICAN CHURCH JUNCTION ASABA,0,0,0,0,1,0,1,1,0,0,0,0,0,
DELTA,OSHIMILI - SOUTH,CABLE POINT  I,10-15-10-011,ST PATRICK JUNCTION CABLE POINT ASABA,0,0,0,0,1,0,1,1,0,0,0,0,0,
DELTA,OSHIMILI - SOUTH,CABLE POINT  I,10-15-10-014,POWERLINE PRIMARY SCHOOL - POWERLINE,0,0,0,0,1,0,1,1,0,0,0,0,0,
DELTA,OSHIMILI - SOUTH,CABLE POINT  I,10-15-10-015,COLLEGE OF EDUCATION - COLLEGE OF EDUCATION/SHANGOTOLA I,0,0,0,0,1,0,1,1,0,0,0,0,0,
DELTA,PATANI,PATANI   II,10-16-03-003,EKISE    III,0,0,0,0,1,0,1,1,0,0,0,0,0,
DELTA,PATANI,PATANI   III,10-16-04-002,OGEINWARE  II (OPUKABOR PRIMARY SCHOOL),0,0,0,0,1,0,1,1,0,0,0,0,0,
DELTA,PATANI,PATANI   III,10-16-04-005,AFINAWARE  I   BY CATHOLIC CHURCH,0,0,0,0,1,0,1,1,0,0,0,0,0,
DELTA,PATANI,TAWARE/KOLOWARA AVEN,10-16-05-003,KOLOWARE  PRIMARY SCHOOL,0,0,0,0,1,0,1,1,0,0,0,0,0,
DELTA,PATANI,TORU-ANGIAMA,10-16-07-005,"FORMER SECONDARY SCHOOL, TORU-ANGIAMA II",0,0,0,0,1,0,1,1,0,0,0,0,0,
DELTA,SAPELE,SAPELE  URBAN  IV,10-17-04-007,"UHEREVIE PRIMARY SCHOOL, SAPELE II",0,0,0,0,1,0,1,1,0,0,0,0,0,
DELTA,SAPELE,SAPELE  URBAN  IV,10-17-04-009,"PALMER PRIMARY SCHOOL, SAPELE I",0,0,0,0,1,0,1,1,0,0,0,0,0,
DELTA,SAPELE,SAPELE  URBAN  IV,10-17-04-010,"PALMER PRIMARY SCHOOL, SAPELE II",0,0,0,0,1,0,1,1,0,0,0,0,0,
DELTA,SAPELE,SAPELE  URBAN  IV,10-17-04-014,AMAGIYA/ORIAKHI ROAD I,0,0,0,0,1,0,1,1,0,0,0,0,0,
DELTA,SAPELE,SAPELE  URBAN  IV,10-17-04-016,ABEKE/NEW ROAD JUNCTION I,0,0,0,0,1,0,1,1,0,0,0,0,0,
DELTA,SAPELE,SAPELE  URBAN  IV,10-17-04-017,ABEKE/NEW ROAD JUNCTION II,0,0,0,0,1,0,1,1,0,0,0,0,0,
DELTA,SAPELE,SAPELE  URBAN  V,10-17-05-006,LABOARD ROAD BY URHIAPELE AMEH,0,0,0,0,1,0,1,1,0,0,0,0,0,
DELTA,SAPELE,SAPELE  URBAN  V,10-17-05-009,BY APATA CHURCH,0,0,0,0,1,0,1,1,0,0,0,0,0,
DELTA,SAPELE,SAPELE  URBAN  V,10-17-05-010,ADEOLA ROAD/AYOMANOR COMPOUND,0,0,0,0,1,0,1,1,0,0,0,0,0,
DELTA,SAPELE,SAPELE  URBAN  VI,10-17-06-012,HAUSA QUARTERS BY URHOBO ROAD,0,0,0,0,1,0,1,1,0,0,0,0,0,
DELTA,SAPELE,ELUME,10-17-10-005,OKUOKE COMMUNITY TOWNHALL,0,0,0,0,1,0,1,1,0,0,0,0,0,
DELTA,SAPELE,ELUME,10-17-10-016,O/S OLOHO VILLAGE,0,0,0,0,1,0,1,1,0,0,0,0,0,
DELTA,SAPELE,OKOKPORO/UGBORHEN,10-17-11-004,O/S OKUODEDE  I AND II,0,0,0,0,1,0,1,1,0,0,0,0,0,
DELTA,UDU,UDU  IV,10-18-04-005,"UBOGO PRIMARY SCHOOL, UBOGO II",0,0,0,0,1,0,1,1,0,0,0,0,0,
DELTA,UDU,UDU  IV,10-18-04-006,"EKROTA TOWN HALL, EKROTA",0,0,0,0,1,0,1,1,0,0,0,0,0,
DELTA,UDU,UDU  IV,10-18-04-007,"UKPERERHEN PRIMARY SCHOOL, UKPERERHEN",0,0,0,0,1,0,1,1,0,0,0,0,0,
DELTA,UDU,UDU  IV,10-18-04-009,"OBUBU PRIMARY SCHOOL, OBUBU I",0,0,0,0,1,0,1,1,0,0,0,0,0,
DELTA,UDU,OVWIAN   I,10-18-07-006,"OGHWORO HALL, OVWIAN",0,0,0,0,1,0,1,1,0,0,0,0,0,
DELTA,UDU,OVWIAN   I,10-18-07-009,"OGODOGU JUNCTION, OVWIAN",0,0,0,0,1,0,1,1,0,0,0,0,0,
DELTA,UDU,ALADJA,10-18-10-002,"ALADJA PRIMARY SCHOOL, ALADJA II",0,0,0,0,1,0,1,1,0,0,0,0,0,
DELTA,UGHELLI NORTH,AGBARHA,10-19-01-023,"SANIKO/GANO QUARTERS, GANA VILLAGE",0,0,0,0,1,0,1,1,0,0,0,0,0,
DELTA,UGHELLI NORTH,OGOR,10-19-02-007,OGBE OPHORI/UHURIE/UMILAHWA/OFOVWE PRIMARY SCHOOL EKRUSE STREET,0,0,0,0,1,0,1,1,0,0,0,0,0,
DELTA,UGHELLI NORTH,OROGUN   I,10-19-03-006,OKUMERE/OBUGHE/EFE PRIMARY SCHOOL,0,0,0,0,1,0,1,1,0,0,0,0,0,
DELTA,UGHELLI NORTH,OROGUN   II,10-19-04-021,"UNUKPO/OMO PRIMARY SCHOOL, OVARA",0,0,0,0,1,0,1,1,0,0,0,0,0,
DELTA,UGHELLI NORTH,UGHELLI  I,10-19-05-001,"OTOVWODO TOWN HALL, UDUOPHOR/UDUERE QUARTERS I, OTOVWODO",0,0,0,0,1,0,1,1,0,0,0,0,0,
DELTA,UGHELLI NORTH,UGHELLI  I,10-19-05-004,"FRONT OF KOGBODI SCHOOL, OGHOGHOVWE ROAD/SCHOOL AREA, OTOVWODO",0,0,0,0,1,0,1,1,0,0,0,0,0,
DELTA,UGHELLI NORTH,UGHELLI  I,10-19-05-011,"EKIUGBO TOWN HALL, OWHE FARM/EKIUGBO SHRINE, EKIUGBO",0,0,0,0,1,0,1,1,0,0,0,0,0,
DELTA,UGHELLI NORTH,UGHELLI  I,10-19-05-012,"EKIUGBO TOWN HALL, IGBEN ST./OGBE ODE TO TRAVELLERS CAVE, EKIUGBO",0,0,0,0,1,0,1,1,0,0,0,0,0,
DELTA,UGHELLI NORTH,UGHELLI  II,10-19-06-020,"OTERI HALL OGBE ODE/OTERI HALL, OTERI",0,0,0,0,1,0,1,1,0,0,0,0,0,
DELTA,UGHELLI NORTH,UGHELLI  II,10-19-06-021,"AGASIONA/ITIVE/OGBE EKI/OTERI HALL, UGHELLI",0,0,0,0,1,0,1,1,0,0,0,0,0,
DELTA,UGHELLI NORTH,UGHELLI  II,10-19-06-024,"OHARISI/MOWOE STREET/MOWOR JUNCTION, UGHELLI",0,0,0,0,1,0,1,1,0,0,0,0,0,
