State,LGA,Ward,PU-Code,PU-Name,Accredited_Voters,Registered_Voters,Results_Found,Transcription_Count,Result_Sheet_Stamped,Result_Sheet_Corrected,Result_Sheet_Invalid,Result_Sheet_Unclear,Result_Sheet_Unsigned,APC,LP,PDP,NNPP,Results_File
EDO,AKOKO EDO,IGARRA II,12-01-02-016,"UTUA I, OPPOSITE AJAYI'S COMP",0,0,0,0,1,0,1,1,0,0,0,0,0,
EDO,AKOKO EDO,IGARRA II,12-01-02-017,"UTUA I, OPPOSITE CUSTOMARY COURT II",0,0,0,0,1,0,1,1,0,0,0,0,0,
EDO,AKOKO EDO,IGARRA II,12-01-02-018,"UTUA I, OPEN SPACE NR GADIMOH'S HOUSE II",0,0,0,0,1,0,1,1,0,0,0,0,0,
EDO,AKOKO EDO,IGARRA II,12-01-02-019,"UTUA I, OPP GODSTIME NURSERY SCHOOL",0,0,0,0,1,0,1,1,0,0,0,0,0,
EDO,AKOKO EDO,IGARRA II,12-01-02-020,"UFA II, IRETOJI PRY SCHOOL II",0,0,0,0,1,0,1,1,0,0,0,0,0,
EDO,AKOKO EDO,IGARRA II,12-01-02-021,"UFA II, ANGLICAN GRAMMAR IGARRA",0,0,0,0,1,0,1,1,0,0,0,0,0,
EDO,AKOKO EDO,IGARRA II,12-01-02-022,"UFA II, OPEN SPACE IN FRONT OF J.T SAIKI'S HOUSE ",0,0,0,0,1,0,1,1,0,0,0,0,0,
EDO,AKOKO EDO,IGARRA II,12-01-02-023,"OPEN SPACE OPPOSITE AFEKHAI'S HOUSE, UFA II.",0,0,0,0,1,0,1,1,0,0,0,0,0,
EDO,AKOKO EDO,IGARRA II,12-01-02-024,"OPEN SPACE BY ALAFIA JUNCTION, UFA II",0,0,0,0,1,0,1,1,0,0,0,0,0,
EDO,AKOKO EDO,IGARRA II,12-01-02-025,"UFA II, UFA HALL II",0,0,0,0,1,0,1,1,0,0,0,0,0,
EDO,AKOKO EDO,IGARRA II,12-01-02-026,"OPEN SPACE OPPOSITE  ADAM'S HOUSE, UFA II.",0,0,0,0,1,0,1,1,0,0,0,0,0,
EDO,AKOKO EDO,IGARRA II,12-01-02-027,"UFA II, AKUKU PRY HEALTH CENTER, OPEN SPACE",0,0,0,0,1,0,1,1,0,0,0,0,0,
EDO,AKOKO EDO,IGARRA II,12-01-02-028,OPEN  SPACE BY  AKUKU ST PETERS ANG CHURCH.,0,0,0,0,1,0,1,1,0,0,0,0,0,
EDO,AKOKO EDO,OLOMA/ OKPE/ IJAJA/ KAKUMA/ ANYARA,12-01-06-016,ANYARAN ARAROMI PRY SCH,0,0,0,0,1,0,1,1,0,0,0,0,0,
EDO,AKOKO EDO,OLOMA/ OKPE/ IJAJA/ KAKUMA/ ANYARA,12-01-06-017,"OPEN SPACE, IKAKUMOH PALACE SQUARE",0,0,0,0,1,0,1,1,0,0,0,0,0,
EDO,AKOKO EDO,OLOMA/ OKPE/ IJAJA/ KAKUMA/ ANYARA,12-01-06-018,OPEN SPACE OPPOSITE POLICE POST,0,0,0,0,1,0,1,1,0,0,0,0,0,
EDO,ESAN SOUTH EAST,ILLUSHI II,12-05-09-007,OKWOSHIMILI/ONYMA/ONYMA/ADAGU/IYEGBI/OWON IFEKU ISLAND PRI. SCH. II,0,0,0,0,1,0,1,1,0,0,0,0,0,
EDO,ESAN SOUTH EAST,ILLUSHI II,12-05-09-009,"OKPATAWOH, OKPATOWO TOWN HALL II",0,0,0,0,1,0,1,1,0,0,0,0,0,
EDO,ESAN SOUTH EAST,ILLUSHI II,12-05-09-012,"AKPALAGI MARKET, ILLUSHI",0,0,0,0,1,0,1,1,0,0,0,0,0,
EDO,ESAN SOUTH EAST,ILLUSHI II,12-05-09-013,"ESAN QTR, I&II NIGER BANK PRIMARY SCHOOL II",0,0,0,0,1,0,1,1,0,0,0,0,0,
EDO,ESAN SOUTH EAST,OHORDUA,12-05-04-012,ID OKUN/ IBHIEDU/ ID OTIE 1/11 - IBHIEDU PRI SCHOOL II -  OPPOSITE MARKET,0,0,0,0,1,0,1,1,0,0,0,0,0,
EDO,ETSAKO CENTRAL,EKPERI I,12-07-06-010,"EGHIEGBAI PRY SCH, UGBEKPE-EKPERI",0,0,0,0,1,0,1,1,0,0,0,0,0,
EDO,ETSAKO CENTRAL,EKPERI I,12-07-06-011,UGBEKPE COMMUNITY MKT SQUARE,0,0,0,0,1,0,1,1,0,0,0,0,0,
EDO,ETSAKO CENTRAL,EKPERI I,12-07-06-012,"EKPERI GRAMM. SCH., UGBEKPE-EKPERI",0,0,0,0,1,0,1,1,0,0,0,0,0,
EDO,ETSAKO CENTRAL,SOUTH UNEME II,12-07-10-008,"PRIMARY HEALTH CENTER, UDOCHI VILLAGE III",0,0,0,0,1,0,1,1,0,0,0,0,0,
EDO,ETSAKO EAST,OKPELLA I,12-08-05-010,"IKPOMAZA GRAMMAR SCH II, OKPELLA",0,0,0,0,1,0,1,1,0,0,0,0,0,
EDO,ETSAKO EAST,OKPELLA I,12-08-05-011,"AFEGBUA PRY. SCHOOL, IMIETEMEGHE/ITEKUME/IMIADATSE II",0,0,0,0,1,0,1,1,0,0,0,0,0,
EDO,ETSAKO EAST,OKPELLA I,12-08-05-012,"UTAYOKHE PRY SCH, IMIOSUMU/IMOGIA II",0,0,0,0,1,0,1,1,0,0,0,0,0,
EDO,ETSAKO EAST,OKPELLA I,12-08-05-013,"PRIMARY HEALTH CENTRE, IMIOGA, OKPELLA",0,0,0,0,1,0,1,1,0,0,0,0,0,
EDO,ETSAKO EAST,OKPELLA I,12-08-05-014,TOWN HALL IMIANOKO,0,0,0,0,1,0,1,1,0,0,0,0,0,
EDO,ETSAKO EAST,OKPELLA I,12-08-05-016,IMIAGBESE P/S IMIAGBESE IV,0,0,0,0,1,0,1,1,0,0,0,0,0,
EDO,ETSAKO EAST,OKPELLA I,12-08-05-017,UDIOKE VILLAGE SQ.,0,0,0,0,1,0,1,1,0,0,0,0,0,
EDO,ETSAKO EAST,OKPELLA I,12-08-05-018,AFEGBUA P/S AWUYEMI III,0,0,0,0,1,0,1,1,0,0,0,0,0,
EDO,ETSAKO EAST,OKPELLA I,12-08-05-019,AFEGBUA P/S AWUYEMI IV,0,0,0,0,1,0,1,1,0,0,0,0,0,
EDO,ETSAKO EAST,OKPELLA II,12-08-06-010,UGBEDOGUN  P/S OGUTE II,0,0,0,0,1,0,1,1,0,0,0,0,0,
EDO,ETSAKO EAST,OKPELLA II,12-08-06-012,EKURI P/S IGHIATSE/IMIHIRHOKHO/IMANABA III,0,0,0,0,1,0,1,1,0,0,0,0,0,
EDO,ETSAKO EAST,OKPELLA II,12-08-06-013,"EKURI P/S IV, IGHATSE /IMHIRHOKHO /IMANABA",0,0,0,0,1,0,1,1,0,0,0,0,0,
EDO,ETSAKO EAST,OKPELLA II,12-08-06-015,OFUOKHA P/S II ITUROGBE,0,0,0,0,1,0,1,1,0,0,0,0,0,
EDO,ETSAKO EAST,OKPELLA II,12-08-06-016,UGBEDOGUN P/S OKOKPETU II,0,0,0,0,1,0,1,1,0,0,0,0,0,
EDO,ETSAKO EAST,OKPELLA III,12-08-07-009,LGA MATERNITY  IMIOMIME/IDANE/OKE III,0,0,0,0,1,0,1,1,0,0,0,0,0,
EDO,ETSAKO EAST,OKPELLA III,12-08-07-010,LGA MATERNITY IMIOMIME /IDANE/ OKE IV PRY HEALTH CENTER,0,0,0,0,1,0,1,1,0,0,0,0,0,
EDO,ETSAKO EAST,OKPELLA III,12-08-07-011,ERAMHE P/S IMIOKO/UTEGIE II,0,0,0,0,1,0,1,1,0,0,0,0,0,
EDO,ETSAKO EAST,OKPELLA III,12-08-07-012,ERAMHE P/S. IMIOKO UTEGIE III,0,0,0,0,1,0,1,1,0,0,0,0,0,
EDO,ETSAKO EAST,OKPELLA III,12-08-07-013,OGODOR P/S II OGIRIGA RD,0,0,0,0,1,0,1,1,0,0,0,0,0,
EDO,ETSAKO EAST,OKPELLA III,12-08-07-014,PRIMARY HEALTH CENTER OGIRIGA,0,0,0,0,1,0,1,1,0,0,0,0,0,
EDO,ETSAKO EAST,OKPELLA III,12-08-07-015,AFOKPELLA SEC/SCH I OGEDE,0,0,0,0,1,0,1,1,0,0,0,0,0,
EDO,ETSAKO EAST,OKPELLA III,12-08-07-016,"AFOKPELLA SEC/SCH II ,OGEDE",0,0,0,0,1,0,1,1,0,0,0,0,0,
EDO,ETSAKO EAST,OKPELLA III,12-08-07-017,EWO MARKET OFOMEGBE,0,0,0,0,1,0,1,1,0,0,0,0,0,
EDO,ETSAKO EAST,OKPELLA III,12-08-07-018,"KALABA COMMUNITY  CENTER, KALABAR",0,0,0,0,1,0,1,1,0,0,0,0,0,
EDO,ETSAKO EAST,OKPELLA IV,12-08-08-018,EVEVA P/ S OKUGBE III OKUGBE,0,0,0,0,1,0,1,1,0,0,0,0,0,
EDO,ETSAKO EAST,WANNO II,12-08-03-011,"IVIOKWE VILLAGE SQUARE, IVIOKWE",0,0,0,0,1,0,1,1,0,0,0,0,0,
EDO,ETSAKO EAST,WANNO II,12-08-03-012,"IVIOMOSI TOWN HALL, IVIOMOSI",0,0,0,0,1,0,1,1,0,0,0,0,0,
EDO,ETSAKO EAST,WANNO II,12-08-03-013,IFASHIE PRIMARY HEALTH CENTRE IVIOGHE,0,0,0,0,1,0,1,1,0,0,0,0,0,
EDO,ETSAKO EAST,WANNO II,12-08-03-014,IVIOKPO MKT /SQ IVIOGHE BY IVIOKPO,0,0,0,0,1,0,1,1,0,0,0,0,0,
EDO,ETSAKO EAST,WANNO II,12-08-03-015,IGIODE /ITOGBO MKT SQ,0,0,0,0,1,0,1,1,0,0,0,0,0,
EDO,ETSAKO EAST,WANNO II,12-08-03-016,IGIODE SEC SCH IGIODE.,0,0,0,0,1,0,1,1,0,0,0,0,0,
EDO,ETSAKO EAST,WANNO II,12-08-03-017,IGIODE ITHEVUGBE MKT SQ,0,0,0,0,1,0,1,1,0,0,0,0,0,
EDO,ETSAKO EAST,WANNO II,12-08-03-018,UDOCHI OKE/UDOCHINAOWA VILL. SQ,0,0,0,0,1,0,1,1,0,0,0,0,0,
EDO,ETSAKO  WEST,AVIELE,12-09-07-031,UGHIOLI SECONDARY SCHOOL,0,0,0,0,1,0,1,1,0,0,0,0,0,
EDO,ETSAKO  WEST,UZAIRUE SOUTH EAST,12-09-12-016,OPEN SPACE -IYOKU - UTUKWE AFASHIO,0,0,0,0,1,0,1,1,0,0,0,0,0,
EDO,ETSAKO  WEST,UZAIRUE SOUTH EAST,12-09-12-017,"OPEN SPACE,OLD SAWMILL.IGHOGHO QTRS.",0,0,0,0,1,0,1,1,0,0,0,0,0,
EDO,ETSAKO  WEST,UZAIRUE SOUTH EAST,12-09-12-018,"IKHABIGBO III, IKHABIGBO P/S.",0,0,0,0,1,0,1,1,0,0,0,0,0,
EDO,ETSAKO  WEST,UZAIRUE SOUTH EAST,12-09-12-019,"IKHABIGBO TOWN HALL, IKHABIGBO.",0,0,0,0,1,0,1,1,0,0,0,0,0,
EDO,ETSAKO  WEST,UZAIRUE SOUTH EAST,12-09-12-020,"OLD PALACE JUNCTION, AFOKHAI",0,0,0,0,1,0,1,1,0,0,0,0,0,
EDO,ETSAKO  WEST,UZAIRUE SOUTH EAST,12-09-12-021,"OPEN SPACE,OPP. IREKPAI CENTRAL MOSQUE.",0,0,0,0,1,0,1,1,0,0,0,0,0,
EDO,ETSAKO  WEST,UZAIRUE SOUTH EAST,12-09-12-023,"AYOGWIRI TOWN HALL,AYOGWIRI",0,0,0,0,1,0,1,1,0,0,0,0,0,
EDO,OWAN WEST,SABONGIDA/ORA/OGBETURU,12-17-04-020,OPEN SPACE OPPOSITE OLD OWAN WEST PARK,0,0,0,0,1,0,1,1,0,0,0,0,0,
